{
  "$schema": "../schemas/collection.schema.json",
  "id": "training-onboarding",
  "name": "Training And Onboarding",
  "status": "draft",
  "summary": "Skills for teaching new HPC users, including Slurm jobs, notebooks, Open OnDemand templates, TensorBoard monitors, Streamlit apps, RStudio, IDE tunnels, Python, R, Julia, and MATLAB workloads, and workshop environments.",
  "audience": ["instructors", "new HPC users", "training cluster maintainers"],
  "skill_ids": [
    "training-cluster-reset-checklist",
    "slurm-submit-job",
    "interactive-session",
    "open-ondemand-batch-connect",
    "jupyter-on-slurm",
    "rstudio-on-slurm",
    "vscode-tunnel-on-slurm",
    "python-virtualenv-on-hpc",
    "tensorboard-on-slurm",
    "streamlit-on-slurm",
    "rscript-on-slurm",
    "julia-on-slurm",
    "matlab-batch-on-slurm",
    "conda-mamba-on-hpc",
    "module-environment-debug",
    "dataset-staging-to-scratch",
    "job-failure-triage"
  ],
  "maintainers": [
    {
      "name": "HPC Skill Hub Maintainers"
    }
  ]
}
