{
  "$schema": "../schemas/collection.schema.json",
  "id": "core-hpc",
  "name": "Core HPC",
  "status": "draft",
  "summary": "Starter skills for Slurm jobs, arrays, restartable workflows, notebooks, OpenMP placement, debugging, and storage triage.",
  "audience": ["new HPC users", "research software engineers", "support teams"],
  "skill_ids": [
    "slurm-submit-job",
    "slurm-job-array-patterns",
    "slurm-monitor-job",
    "slurm-resource-estimator",
    "checkpoint-restart-workflow",
    "job-failure-triage",
    "interactive-session",
    "jupyter-on-slurm",
    "openmp-thread-affinity",
    "quota-and-filesystem-triage",
    "scratch-storage-management"
  ],
  "maintainers": [
    {
      "name": "HPC Skill Hub Maintainers"
    }
  ]
}
