{
  "$schema": "../schemas/collection.schema.json",
  "id": "scheduler-basics",
  "name": "Scheduler Basics",
  "status": "draft",
  "summary": "Starter skills for submitting and comparing basic jobs across Slurm, PBS-style, and LSF schedulers.",
  "audience": ["new HPC users", "training instructors", "support teams", "sites with mixed schedulers"],
  "skill_ids": [
    "slurm-submit-job",
    "pbs-submit-job",
    "lsf-submit-job",
    "job-failure-triage",
    "reproducible-run-capture"
  ],
  "maintainers": [
    {
      "name": "HPC Skill Hub Maintainers"
    }
  ]
}
