{
  "$schema": "../schemas/collection.schema.json",
  "id": "simulation-workflows",
  "name": "Simulation Workflows",
  "status": "draft",
  "summary": "Domain skills for MPI/GPU-heavy simulation, MPI fabric evidence, hybrid MPI/OpenMP layouts, rank binding diagnostics, parallel HDF5/NetCDF preflight, Darshan I/O profile analysis, Lustre striping layout planning, electronic-structure, CFD, weather, restart, profiling, and storage-smoke workflows on Slurm-backed HPC systems.",
  "audience": ["simulation teams", "computational scientists", "performance engineers"],
  "skill_ids": [
    "gromacs-on-slurm",
    "lammps-on-slurm",
    "namd-on-slurm",
    "quantum-espresso-on-slurm",
    "cp2k-on-slurm",
    "openfoam-on-slurm",
    "wrf-on-slurm",
    "mpi-hello-and-benchmark",
    "mpi-fabric-diagnostics",
    "mpi-rank-binding-diagnostics",
    "hybrid-mpi-openmp-slurm",
    "parallel-hdf5-netcdf-preflight",
    "darshan-io-profile-analysis",
    "lustre-striping-layout-planning",
    "openmp-thread-affinity",
    "ior-mdtest-storage-smoke",
    "performance-profile-basic",
    "reproducible-run-capture",
    "checkpoint-restart-workflow"
  ],
  "maintainers": [
    {
      "name": "HPC Skill Hub Maintainers"
    }
  ]
}
