{
  "$schema": "../schemas/collection.schema.json",
  "id": "workflow-engines",
  "name": "Workflow Engines",
  "status": "draft",
  "summary": "Skills for launching portable workflow engines, CWL/WDL runs, Dask and Parsl worker pools, file descriptor and time-limit triage, lightweight Slurm dependency chains, and safe array retry planning.",
  "audience": ["pipeline authors", "bioinformatics teams", "workflow platform maintainers"],
  "skill_ids": [
    "slurm-job-dependency-chain",
    "slurm-array-retry-plan",
    "cwl-on-slurm",
    "wdl-on-slurm",
    "file-descriptor-limit-triage",
    "slurm-time-limit-triage",
    "dask-jobqueue-on-slurm",
    "parsl-on-slurm",
    "nextflow-on-slurm",
    "snakemake-on-slurm",
    "nf-core-on-slurm"
  ],
  "maintainers": [
    {
      "name": "HPC Skill Hub Maintainers"
    }
  ]
}
